{
  "module": "profiling_debug",
  "code": "L",
  "expectedCount": 30,
  "questions": [
    {
      "id": "L-LAUNCH-001",
      "file": "data/questions/L/L-LAUNCH-001.json",
      "reviewStatus": "draft",
      "contentCardFile": "data/content-cards/L/L-LAUNCH-001.json",
      "version": 1
    },
    {
      "id": "L-TIMING-002",
      "file": "data/questions/L/L-TIMING-002.json",
      "reviewStatus": "draft",
      "contentCardFile": "data/content-cards/L/L-TIMING-002.json",
      "version": 1
    },
    {
      "id": "L-TOL-003",
      "file": "data/questions/L/L-TOL-003.json",
      "reviewStatus": "draft",
      "contentCardFile": "data/content-cards/L/L-TOL-003.json",
      "version": 1
    },
    {
      "id": "L-NCU-004",
      "file": "data/questions/L/L-NCU-004.json",
      "reviewStatus": "draft",
      "contentCardFile": "data/content-cards/L/L-NCU-004.json",
      "version": 1
    },
    {
      "id": "L-WARMUP-005",
      "file": "data/questions/L/L-WARMUP-005.json",
      "reviewStatus": "draft",
      "contentCardFile": "data/content-cards/L/L-WARMUP-005.json",
      "version": 1
    },
    {
      "id": "L-CPUEVT-006",
      "file": "data/questions/L/L-CPUEVT-006.json",
      "reviewStatus": "draft",
      "contentCardFile": "data/content-cards/L/L-CPUEVT-006.json",
      "version": 1
    },
    {
      "id": "L-ASYNC-007",
      "file": "data/questions/L/L-ASYNC-007.json",
      "reviewStatus": "draft",
      "contentCardFile": "data/content-cards/L/L-ASYNC-007.json",
      "version": 1
    },
    {
      "id": "L-STREAM-008",
      "file": "data/questions/L/L-STREAM-008.json",
      "reviewStatus": "draft",
      "contentCardFile": "data/content-cards/L/L-STREAM-008.json",
      "version": 2
    },
    {
      "id": "L-GOLDEN-009",
      "file": "data/questions/L/L-GOLDEN-009.json",
      "reviewStatus": "draft",
      "contentCardFile": "data/content-cards/L/L-GOLDEN-009.json",
      "version": 1
    },
    {
      "id": "L-DIFFTEST-010",
      "file": "data/questions/L/L-DIFFTEST-010.json",
      "reviewStatus": "draft",
      "contentCardFile": "data/content-cards/L/L-DIFFTEST-010.json",
      "version": 1
    },
    {
      "id": "L-TOL2-011",
      "file": "data/questions/L/L-TOL2-011.json",
      "reviewStatus": "draft",
      "contentCardFile": "data/content-cards/L/L-TOL2-011.json",
      "version": 1
    },
    {
      "id": "L-SHAPECOV-012",
      "file": "data/questions/L/L-SHAPECOV-012.json",
      "reviewStatus": "draft",
      "contentCardFile": "data/content-cards/L/L-SHAPECOV-012.json",
      "version": 1
    },
    {
      "id": "L-DYNREG-013",
      "file": "data/questions/L/L-DYNREG-013.json",
      "reviewStatus": "draft",
      "contentCardFile": "data/content-cards/L/L-DYNREG-013.json",
      "version": 2
    },
    {
      "id": "L-ACCREG-014",
      "file": "data/questions/L/L-ACCREG-014.json",
      "reviewStatus": "draft",
      "contentCardFile": "data/content-cards/L/L-ACCREG-014.json",
      "version": 1
    },
    {
      "id": "L-NAN-015",
      "file": "data/questions/L/L-NAN-015.json",
      "reviewStatus": "draft",
      "contentCardFile": "data/content-cards/L/L-NAN-015.json",
      "version": 1
    },
    {
      "id": "L-RACE-016",
      "file": "data/questions/L/L-RACE-016.json",
      "reviewStatus": "draft",
      "contentCardFile": "data/content-cards/L/L-RACE-016.json",
      "version": 1
    },
    {
      "id": "L-DETERM-017",
      "file": "data/questions/L/L-DETERM-017.json",
      "reviewStatus": "draft",
      "contentCardFile": "data/content-cards/L/L-DETERM-017.json",
      "version": 2
    },
    {
      "id": "L-NOISE-018",
      "file": "data/questions/L/L-NOISE-018.json",
      "reviewStatus": "draft",
      "contentCardFile": "data/content-cards/L/L-NOISE-018.json",
      "version": 1
    },
    {
      "id": "L-PCTL-019",
      "file": "data/questions/L/L-PCTL-019.json",
      "reviewStatus": "draft",
      "contentCardFile": "data/content-cards/L/L-PCTL-019.json",
      "version": 1
    },
    {
      "id": "L-E2E-020",
      "file": "data/questions/L/L-E2E-020.json",
      "reviewStatus": "draft",
      "contentCardFile": "data/content-cards/L/L-E2E-020.json",
      "version": 1
    },
    {
      "id": "L-ROOFLINE-021",
      "file": "data/questions/L/L-ROOFLINE-021.json",
      "reviewStatus": "draft",
      "contentCardFile": "data/content-cards/L/L-ROOFLINE-021.json",
      "version": 2
    },
    {
      "id": "L-OCC-022",
      "file": "data/questions/L/L-OCC-022.json",
      "reviewStatus": "draft",
      "contentCardFile": "data/content-cards/L/L-OCC-022.json",
      "version": 1
    },
    {
      "id": "L-WARPSTALL-023",
      "file": "data/questions/L/L-WARPSTALL-023.json",
      "reviewStatus": "draft",
      "contentCardFile": "data/content-cards/L/L-WARPSTALL-023.json",
      "version": 1
    },
    {
      "id": "L-REGP-024",
      "file": "data/questions/L/L-REGP-024.json",
      "reviewStatus": "draft",
      "contentCardFile": "data/content-cards/L/L-REGP-024.json",
      "version": 1
    },
    {
      "id": "L-CACHE-025",
      "file": "data/questions/L/L-CACHE-025.json",
      "reviewStatus": "draft",
      "contentCardFile": "data/content-cards/L/L-CACHE-025.json",
      "version": 1
    },
    {
      "id": "L-COMPTIME-026",
      "file": "data/questions/L/L-COMPTIME-026.json",
      "reviewStatus": "draft",
      "contentCardFile": "data/content-cards/L/L-COMPTIME-026.json",
      "version": 1
    },
    {
      "id": "L-BREAKLOG-027",
      "file": "data/questions/L/L-BREAKLOG-027.json",
      "reviewStatus": "draft",
      "contentCardFile": "data/content-cards/L/L-BREAKLOG-027.json",
      "version": 1
    },
    {
      "id": "L-IRDUMP-028",
      "file": "data/questions/L/L-IRDUMP-028.json",
      "reviewStatus": "draft",
      "contentCardFile": "data/content-cards/L/L-IRDUMP-028.json",
      "version": 1
    },
    {
      "id": "L-GENCODE-029",
      "file": "data/questions/L/L-GENCODE-029.json",
      "reviewStatus": "draft",
      "contentCardFile": "data/content-cards/L/L-GENCODE-029.json",
      "version": 1
    },
    {
      "id": "L-PROF-030",
      "file": "data/questions/L/L-PROF-030.json",
      "reviewStatus": "draft",
      "contentCardFile": "data/content-cards/L/L-PROF-030.json",
      "version": 1
    }
  ]
}
