{
  "module": "runtime_deploy",
  "code": "K",
  "expectedCount": 30,
  "questions": [
    {
      "id": "K-BOUND-001",
      "file": "data/questions/K/K-BOUND-001.json",
      "reviewStatus": "draft",
      "contentCardFile": "data/content-cards/K/K-BOUND-001.json",
      "version": 1
    },
    {
      "id": "K-DISPATCH-002",
      "file": "data/questions/K/K-DISPATCH-002.json",
      "reviewStatus": "draft",
      "contentCardFile": "data/content-cards/K/K-DISPATCH-002.json",
      "version": 1
    },
    {
      "id": "K-VM-003",
      "file": "data/questions/K/K-VM-003.json",
      "reviewStatus": "draft",
      "contentCardFile": "data/content-cards/K/K-VM-003.json",
      "version": 1
    },
    {
      "id": "K-AOT-004",
      "file": "data/questions/K/K-AOT-004.json",
      "reviewStatus": "draft",
      "contentCardFile": "data/content-cards/K/K-AOT-004.json",
      "version": 1
    },
    {
      "id": "K-ABI-005",
      "file": "data/questions/K/K-ABI-005.json",
      "reviewStatus": "draft",
      "contentCardFile": "data/content-cards/K/K-ABI-005.json",
      "version": 1
    },
    {
      "id": "K-REGISTRY-006",
      "file": "data/questions/K/K-REGISTRY-006.json",
      "reviewStatus": "draft",
      "contentCardFile": "data/content-cards/K/K-REGISTRY-006.json",
      "version": 1
    },
    {
      "id": "K-PLACE-007",
      "file": "data/questions/K/K-PLACE-007.json",
      "reviewStatus": "draft",
      "contentCardFile": "data/content-cards/K/K-PLACE-007.json",
      "version": 1
    },
    {
      "id": "K-ALLOC-008",
      "file": "data/questions/K/K-ALLOC-008.json",
      "reviewStatus": "draft",
      "contentCardFile": "data/content-cards/K/K-ALLOC-008.json",
      "version": 1
    },
    {
      "id": "K-STREAM-009",
      "file": "data/questions/K/K-STREAM-009.json",
      "reviewStatus": "draft",
      "contentCardFile": "data/content-cards/K/K-STREAM-009.json",
      "version": 1
    },
    {
      "id": "K-SYNC-010",
      "file": "data/questions/K/K-SYNC-010.json",
      "reviewStatus": "draft",
      "contentCardFile": "data/content-cards/K/K-SYNC-010.json",
      "version": 1
    },
    {
      "id": "K-FALLBACK-011",
      "file": "data/questions/K/K-FALLBACK-011.json",
      "reviewStatus": "draft",
      "contentCardFile": "data/content-cards/K/K-FALLBACK-011.json",
      "version": 1
    },
    {
      "id": "K-CUSTOM-012",
      "file": "data/questions/K/K-CUSTOM-012.json",
      "reviewStatus": "draft",
      "contentCardFile": "data/content-cards/K/K-CUSTOM-012.json",
      "version": 1
    },
    {
      "id": "K-EXTLIB-013",
      "file": "data/questions/K/K-EXTLIB-013.json",
      "reviewStatus": "draft",
      "contentCardFile": "data/content-cards/K/K-EXTLIB-013.json",
      "version": 1
    },
    {
      "id": "K-ONNX-014",
      "file": "data/questions/K/K-ONNX-014.json",
      "reviewStatus": "draft",
      "contentCardFile": "data/content-cards/K/K-ONNX-014.json",
      "version": 1
    },
    {
      "id": "K-OPSET-015",
      "file": "data/questions/K/K-OPSET-015.json",
      "reviewStatus": "draft",
      "contentCardFile": "data/content-cards/K/K-OPSET-015.json",
      "version": 1
    },
    {
      "id": "K-ONNXSHAPE-016",
      "file": "data/questions/K/K-ONNXSHAPE-016.json",
      "reviewStatus": "draft",
      "contentCardFile": "data/content-cards/K/K-ONNXSHAPE-016.json",
      "version": 1
    },
    {
      "id": "K-ONNXVER-017",
      "file": "data/questions/K/K-ONNXVER-017.json",
      "reviewStatus": "draft",
      "contentCardFile": "data/content-cards/K/K-ONNXVER-017.json",
      "version": 2
    },
    {
      "id": "K-STHLO-018",
      "file": "data/questions/K/K-STHLO-018.json",
      "reviewStatus": "draft",
      "contentCardFile": "data/content-cards/K/K-STHLO-018.json",
      "version": 1
    },
    {
      "id": "K-TRT-019",
      "file": "data/questions/K/K-TRT-019.json",
      "reviewStatus": "draft",
      "contentCardFile": "data/content-cards/K/K-TRT-019.json",
      "version": 1
    },
    {
      "id": "K-TRTPLAN-020",
      "file": "data/questions/K/K-TRTPLAN-020.json",
      "reviewStatus": "draft",
      "contentCardFile": "data/content-cards/K/K-TRTPLAN-020.json",
      "version": 1
    },
    {
      "id": "K-TRTBUILD-021",
      "file": "data/questions/K/K-TRTBUILD-021.json",
      "reviewStatus": "draft",
      "contentCardFile": "data/content-cards/K/K-TRTBUILD-021.json",
      "version": 1
    },
    {
      "id": "K-AOTI-022",
      "file": "data/questions/K/K-AOTI-022.json",
      "reviewStatus": "draft",
      "contentCardFile": "data/content-cards/K/K-AOTI-022.json",
      "version": 1
    },
    {
      "id": "K-AOTIRT-023",
      "file": "data/questions/K/K-AOTIRT-023.json",
      "reviewStatus": "draft",
      "contentCardFile": "data/content-cards/K/K-AOTIRT-023.json",
      "version": 1
    },
    {
      "id": "K-TVMRT-024",
      "file": "data/questions/K/K-TVMRT-024.json",
      "reviewStatus": "draft",
      "contentCardFile": "data/content-cards/K/K-TVMRT-024.json",
      "version": 1
    },
    {
      "id": "K-IREE-025",
      "file": "data/questions/K/K-IREE-025.json",
      "reviewStatus": "draft",
      "contentCardFile": "data/content-cards/K/K-IREE-025.json",
      "version": 1
    },
    {
      "id": "K-SHAPE-026",
      "file": "data/questions/K/K-SHAPE-026.json",
      "reviewStatus": "draft",
      "contentCardFile": "data/content-cards/K/K-SHAPE-026.json",
      "version": 1
    },
    {
      "id": "K-PKG-027",
      "file": "data/questions/K/K-PKG-027.json",
      "reviewStatus": "draft",
      "contentCardFile": "data/content-cards/K/K-PKG-027.json",
      "version": 1
    },
    {
      "id": "K-CROSS-028",
      "file": "data/questions/K/K-CROSS-028.json",
      "reviewStatus": "draft",
      "contentCardFile": "data/content-cards/K/K-CROSS-028.json",
      "version": 1
    },
    {
      "id": "K-HET-029",
      "file": "data/questions/K/K-HET-029.json",
      "reviewStatus": "draft",
      "contentCardFile": "data/content-cards/K/K-HET-029.json",
      "version": 1
    },
    {
      "id": "K-COLD-030",
      "file": "data/questions/K/K-COLD-030.json",
      "reviewStatus": "draft",
      "contentCardFile": "data/content-cards/K/K-COLD-030.json",
      "version": 1
    }
  ]
}
